{
  "schemaVersion": "1.2",
  "tool": "ig-stats.py",
  "mode": "static",
  "analyzed": {
    "path": "/tmp/kds/diagnose",
    "label": "MII KDS Diagnose v2025.0.1",
    "git_commit": "c2d2ff4",
    "timestamp": "2026-06-26T21:58:49Z",
    "input": "/tmp/kds/diagnose",
    "resolved_from": "lokaler Pfad"
  },
  "identity": {
    "id": "mii-ig-diagnose",
    "canonical": "https://www.medizininformatik-initiative.de/fhir/core/modul-diagnose",
    "packageId": "de.medizininformatikinitiative.kerndatensatz.diagnose",
    "name": "MII_IG_Diagnose",
    "title": "MII IG Diagnose",
    "version": "2025.0.1",
    "calver": true,
    "status": "active",
    "fhirVersion": "4.0.1",
    "license": "CC-BY-4.0",
    "publisher": "Medizininformatik Initiative"
  },
  "artifacts": {
    "profiles": 1,
    "extensions": 0,
    "valuesets": 5,
    "codesystems": 1,
    "logicals": 1,
    "capabilitystatements": 1,
    "questionnaires": 0,
    "searchparameters": 0,
    "operations": 0,
    "examples": 4,
    "rulesets": 18,
    "invariants": 0,
    "mappings": 2,
    "total": 13,
    "_source": "input/fsh (FSH-Deklarationen)"
  },
  "artifacts_detail": [
    {
      "type": "RuleSet",
      "name": "SupportResource",
      "instanceOf": null,
      "category": "rulesets",
      "path": "input/fsh/capabilitystatements/CapabilityStatement.fsh",
      "line": 3
    },
    {
      "type": "RuleSet",
      "name": "Profile",
      "instanceOf": null,
      "category": "rulesets",
      "path": "input/fsh/capabilitystatements/CapabilityStatement.fsh",
      "line": 14
    },
    {
      "type": "RuleSet",
      "name": "SupportProfile",
      "instanceOf": null,
      "category": "rulesets",
      "path": "input/fsh/capabilitystatements/CapabilityStatement.fsh",
      "line": 19
    },
    {
      "type": "RuleSet",
      "name": "SupportInteraction",
      "instanceOf": null,
      "category": "rulesets",
      "path": "input/fsh/capabilitystatements/CapabilityStatement.fsh",
      "line": 25
    },
    {
      "type": "RuleSet",
      "name": "SupportSearchParam",
      "instanceOf": null,
      "category": "rulesets",
      "path": "input/fsh/capabilitystatements/CapabilityStatement.fsh",
      "line": 31
    },
    {
      "type": "RuleSet",
      "name": "SupportSpecialSearchParam",
      "instanceOf": null,
      "category": "rulesets",
      "path": "input/fsh/capabilitystatements/CapabilityStatement.fsh",
      "line": 39
    },
    {
      "type": "Instance",
      "name": "mii-cps-diagnose-capabilitystatement",
      "instanceOf": "CapabilityStatement",
      "category": "capabilitystatements",
      "path": "input/fsh/capabilitystatements/CapabilityStatement.fsh",
      "line": 46
    },
    {
      "type": "CodeSystem",
      "name": "MII_CS_Diagnose_Lebensphase_Supplement_SNOMED",
      "instanceOf": null,
      "category": "codesystems",
      "path": "input/fsh/codesystems/mii-cs-diagnose-lebensphase-supplement-snomed.fsh",
      "line": 1
    },
    {
      "type": "Instance",
      "name": "mii-exa-diagnose-condition-minimal",
      "instanceOf": "MII_PR_Diagnose_Condition",
      "category": "examples",
      "path": "input/fsh/instances/mii-exa-diagnose-condition-minimal.fsh",
      "line": 1
    },
    {
      "type": "Instance",
      "name": "mii-exa-diagnose-mehrfachkodierung-primaercode",
      "instanceOf": "MII_PR_Diagnose_Condition",
      "category": "examples",
      "path": "input/fsh/instances/mii-exa-diagnose-mehrfachkodierung-primaercode.fsh",
      "line": 1
    },
    {
      "type": "Instance",
      "name": "mii-exa-diagnose-mehrfachkodierung-sekundaercode",
      "instanceOf": "MII_PR_Diagnose_Condition",
      "category": "examples",
      "path": "input/fsh/instances/mii-exa-diagnose-mehrfachkodierung-sekundaercode.fsh",
      "line": 1
    },
    {
      "type": "Instance",
      "name": "mii-exa-diagnose-multiple-kodierungen",
      "instanceOf": "MII_PR_Diagnose_Condition",
      "category": "examples",
      "path": "input/fsh/instances/mii-exa-diagnose-multiple-kodierungen.fsh",
      "line": 1
    },
    {
      "type": "Logical",
      "name": "MII_LM_Diagnose",
      "instanceOf": null,
      "category": "logicals",
      "path": "input/fsh/logicals/MII_LM_Diagnose.fsh",
      "line": 1
    },
    {
      "type": "Mapping",
      "name": "Diagnose-LogicalModel",
      "instanceOf": null,
      "category": "mappings",
      "path": "input/fsh/logicals/MII_LM_Diagnose.fsh",
      "line": 39
    },
    {
      "type": "Profile",
      "name": "MII_PR_Diagnose_Condition",
      "instanceOf": null,
      "category": "profiles",
      "path": "input/fsh/profiles/MII_PR_Diagnose_Condition.fsh",
      "line": 1
    },
    {
      "type": "Mapping",
      "name": "FHIR-LogicalModel",
      "instanceOf": null,
      "category": "mappings",
      "path": "input/fsh/profiles/MII_PR_Diagnose_Condition.fsh",
      "line": 161
    },
    {
      "type": "RuleSet",
      "name": "LicenseCodeableCCBY40",
      "instanceOf": null,
      "category": "rulesets",
      "path": "input/fsh/rulesets/license-terms.fsh",
      "line": 3
    },
    {
      "type": "RuleSet",
      "name": "LicenseCodeableCCBY40Instance",
      "instanceOf": null,
      "category": "rulesets",
      "path": "input/fsh/rulesets/license-terms.fsh",
      "line": 7
    },
    {
      "type": "RuleSet",
      "name": "MetaProfile",
      "instanceOf": null,
      "category": "rulesets",
      "path": "input/fsh/rulesets/meta-profile.fsh",
      "line": 1
    },
    {
      "type": "RuleSet",
      "name": "Publisher",
      "instanceOf": null,
      "category": "rulesets",
      "path": "input/fsh/rulesets/publisher.fsh",
      "line": 1
    },
    {
      "type": "RuleSet",
      "name": "SP_Publisher",
      "instanceOf": null,
      "category": "rulesets",
      "path": "input/fsh/rulesets/publisher.fsh",
      "line": 6
    },
    {
      "type": "RuleSet",
      "name": "Translation",
      "instanceOf": null,
      "category": "rulesets",
      "path": "input/fsh/rulesets/translation.fsh",
      "line": 1
    },
    {
      "type": "RuleSet",
      "name": "AddSnomedCodingTranslation",
      "instanceOf": null,
      "category": "rulesets",
      "path": "input/fsh/rulesets/translation.fsh",
      "line": 8
    },
    {
      "type": "RuleSet",
      "name": "AddIcd10CodingTranslation",
      "instanceOf": null,
      "category": "rulesets",
      "path": "input/fsh/rulesets/translation.fsh",
      "line": 16
    },
    {
      "type": "RuleSet",
      "name": "AddAlphaIdCodingTranslation",
      "instanceOf": null,
      "category": "rulesets",
      "path": "input/fsh/rulesets/translation.fsh",
      "line": 24
    },
    {
      "type": "RuleSet",
      "name": "AddOrphaCodingTranslation",
      "instanceOf": null,
      "category": "rulesets",
      "path": "input/fsh/rulesets/translation.fsh",
      "line": 32
    },
    {
      "type": "RuleSet",
      "name": "Version",
      "instanceOf": null,
      "category": "rulesets",
      "path": "input/fsh/rulesets/version.fsh",
      "line": 2
    },
    {
      "type": "RuleSet",
      "name": "PR_CS_VS_Version",
      "instanceOf": null,
      "category": "rulesets",
      "path": "input/fsh/rulesets/version.fsh",
      "line": 5
    },
    {
      "type": "ValueSet",
      "name": "MII_VS_Diagnose_DiagnoseCodes_SNOMED",
      "instanceOf": null,
      "category": "valuesets",
      "path": "input/fsh/valuesets/MII_VS_Diagnose_DiagnoseCodes_SNOMED.fsh",
      "line": 1
    },
    {
      "type": "ValueSet",
      "name": "MII_VS_Diagnose_AlphaID",
      "instanceOf": null,
      "category": "valuesets",
      "path": "input/fsh/valuesets/mii-vs-diagnose-alphaid.fsh",
      "line": 1
    },
    {
      "type": "ValueSet",
      "name": "MII_VS_Diagnose_BodyStructure_SNOMED",
      "instanceOf": null,
      "category": "valuesets",
      "path": "input/fsh/valuesets/mii-vs-diagnose-bodysite-snomed.fsh",
      "line": 1
    },
    {
      "type": "ValueSet",
      "name": "MII_VS_Diagnose_ICD10GM",
      "instanceOf": null,
      "category": "valuesets",
      "path": "input/fsh/valuesets/mii-vs-diagnose-icd-10-gm.fsh",
      "line": 1
    },
    {
      "type": "ValueSet",
      "name": "MII_VS_Diagnose_Orphanet",
      "instanceOf": null,
      "category": "valuesets",
      "path": "input/fsh/valuesets/mii-vs-diagnose-orphanet.fsh",
      "line": 1
    }
  ],
  "dependencies": {
    "count": 3,
    "pinned": 1,
    "floating": 2,
    "items": {
      "de.basisprofil.r4": "1.5.x",
      "de.medizininformatikinitiative.kerndatensatz.meta": "2025.0.x",
      "kbv.all.st": "1.27.0"
    },
    "floating_items": [
      "de.basisprofil.r4",
      "de.medizininformatikinitiative.kerndatensatz.meta"
    ],
    "_source": "sushi-config.yaml: dependencies"
  },
  "narrative": {
    "format": "source",
    "pages": 52,
    "pages_all": 61,
    "words": 38118,
    "words_all_incl_stubs": 38191,
    "images": 19,
    "mandatory_present": [],
    "mandatory_missing_in_target": [],
    "files": [
      {
        "path": "implementation-guides/ImplementationGuide-1.x-DE/AnwendungsflleInformationsmodell/BeschreibungvonSzenarienfrdieAnwendungderModule.guide.md",
        "words": 492,
        "kind": "source",
        "stub": false
      },
      {
        "path": "implementation-guides/ImplementationGuide-1.x-DE/AnwendungsflleInformationsmodell/Datenstzeinkl.Beschreibungen.guide.md",
        "words": 606,
        "kind": "source",
        "stub": false
      },
      {
        "path": "implementation-guides/ImplementationGuide-1.x-DE/AnwendungsflleInformationsmodell/UML.guide.md",
        "words": 53,
        "kind": "source",
        "stub": false
      },
      {
        "path": "implementation-guides/ImplementationGuide-1.x-DE/BeschreibungModul.guide.md",
        "words": 3862,
        "kind": "source",
        "stub": false
      },
      {